annotation_id,record_id,brand_target,raw_text,processed_text,label_BATTERY_CHARGING_polarity,label_SOFTWARE_TECHNOLOGY_polarity,label_PERFORMANCE_DRIVING_polarity,label_DESIGN_INTERIOR_polarity,label_SERVICE_AFTERSALES_polarity,label_PRICE_VALUE_polarity
ANN_00343,eb68829ef71cf53f277d0a0ee49261136b52a4bc042856e1d9464f72f7e37493,Mixed,"Cách đây khoảng 1 tuần, một vụ cháy lớn xảy ra tại một nhà khu đậu xe ô tô cao 5 tầng tại công viên giải trí Disneyland ở California. Có tất cả 12 xe ô tô đã bị thiêu hủy hoàn toàn. Chiếc xe được cứu hỏa đầu tiên được xác định là xe hybrid Toyota RAV4, nhưng lời khai của nhân chứng cũng làm dấy lên nghi ngờ về một chiếc Kia Sportage. Cả hai loại xe vẫn đang được điều tra và các nhà chức trách đang xem xét nhiều khả năng khác nhau. Sự cố đã làm bùng lên các cuộc thảo luận xung quanh vấn đề an toàn cháy nổ của xe xăng lai (xe hybrid). Theo Ủy ban An toàn Giao thông Quốc gia của Hoa Kỳ (NTSB), tỷ lệ xảy ra cháy đối với xe xăng lai (xe hybrid) là 3.475 vụ trên 100.000 xe, cao hơn đáng kể [gần gấp 3 lần] so với xe động cơ đốt trong (1.530 vụ) hoặc [cao gần gấp 139 lần] so với xe điện chạy bằng pin (BEV, 25 vụ) như xe điện Vinfast. Phân tích chỉ ra rằng hỗn hợp cấu trúc của hệ thống điện cao áp và nhiên liệu xăng/dầu góp phần gây ra nhiều yếu tố rủi ro cháy nổ của xe xăng lai (xe hybrid). Một số chuyên gia chỉ ra rằng mặc dù xe xăng lai (xe hybrid) có hiệu suất nhiên liệu tốt hơn và lượng khí thải giảm so với xe chạy bằng xăng thông thường, nhưng kỹ thuật công nghệ ứng phó cháy nổ cho hệ thống điện của xe xăng lai (xe hybrid) vẫn chưa được phát triển đầy đủ. Họ nhấn mạnh rằng nếu một chiếc xe xăng lai (xe hybrid) không sử dụng và đậu trong thời gian dài, nó có thể gặp sự cố về điện ở nhiệt độ cao. Xe Trung Quốc hiệu Dongfeng Mage, Huge, MG G50 và BYD Sealion 6 là những mẫu xe xăng lai (xe hybrid). Do đó nguy cơ bị cháy nổ cao hơn gấp 139 lần số với xe thuần điện Vinfast.",cách đây khoảng tuần vụ cháy lớn xảy nhà khu đậu ô_tô cao tầng công_viên giải_trí disneyland california tất_cả 12 ô_tô thiêu_hủy hoàn_toàn chi cứu hỏa đầu_tiên xác_định hybrid toyota_rav4 nhưng lời khai nhân_chứng làm dấy nghi_ngờ chi sportage hai điều_tra và nhà_chức_trách xem_xét khả_năng khác sự_cố làm bùng cuộc thảo_luận xung_quanh vấn_đề an_toàn cháy nổ xăng lai hybrid ủy ban an_toàn giao_thông quốc_gia hoa kỳ_ntsb tỷ_lệ xảy cháy đối_với xăng lai hybrid 475 vụ 100 000 cao đáng_kể gần gấp so động_cơ đốt 530 vụ cao gần gấp 139 so xe_điện chạy bằng pin bev 25 vụ xe_điện VinFast phân_tích hỗn_hợp cấu_trúc hệ_thống điện cao_áp và nhiên_liệu xăng_dầu góp_phần gây y_u_tố rủi_ro cháy nổ xăng lai hybrid một_số chuyên_gia mặc_dù xăng lai hybrid hiệu_suất nhiên_liệu tốt và lượng khí_thải giảm so chạy bằng xăng thông_thường nhưng kỹ_thuật công_nghệ ứng_phó cháy nổ hệ_thống điện xăng lai hybrid chưa phát_triển đầy_đủ họ nhấn_mạnh n_u chi xăng lai hybrid không s_dụng và đậu thời_gian dài nó có_thể gặp sự_cố điện nhiệt_độ cao trung_quốc hiệu dongfeng mage huge mg g50 và byd sealion mẫu xăng lai hybrid do_đó nguy_cơ cháy nổ cao gấp 139 số thuần_điện VinFast,,,,,,
ANN_00344,b0e7504551d5b304720afcee7e1227af51fd7432ce21cd52b9d95373fe38ec50,Mixed,"Byd dolphin theo mình tìm hiểu có 2 bản. Pin 60kw và 45kw. Bản 45kw thì có quảng đường dài hơn nhưng động cơ lại rất yếu. Có khi yếu hơn vf5. Chỉ 95 mã lực, tăng tốc lên 100km/h mất gần 13s. Nặng 1.65 tấn cho bản 45kw. 1.73 tấn cho bản 60kw. Cái này chạy dài như quảng cáo do động cơ yếu thôi a. Bản 60kw của dolphin cũng chạy ngang ngửa hoặc thấp hơn vf6.",BYD_Dolphin tìm_hiểu bản pin 60 kw và 45 kw bản 45 kw quảng_đường dài nhưng động_cơ rất y_u có_khi y_u VinFast_VF5 95 mã_lực tăng_tốc 100 km mất gần 13 nặng 65 tấn bản 45 kw 73 tấn bản 60 kw chạy dài quảng_cáo do động_cơ y_u thôi a_bản 60 kw BYD_Dolphin chạy ngang ng_a thấp VinFast_VF6,,,,,,
ANN_00345,20d9a61c85b0dc771986c546a8213fcf789e33ea70cf1b16812f5774ea2ca59a,Mixed,có bản động cơ xăng 2.0 ko nhỉ 😥😥 hay 1.6 cũng được 😘😘😘,bản động_cơ xăng không nhỉ,,,,,,
ANN_00346,e1c90c5a1aa35934d7a64cc186651b0bc993d02e324a27396ccb4a354d7054ad,Mixed,"Hiện tại thứ quyết định chính đến việc mua xe điện ở VN chính là hệ thống hạ tầng trạm sạc. Giờ có mỗi Vin là phủ toàn quốc. Nên nếu so sánh thì Vin ưu thế hơn hẳn, các hãng khác có ưu việt thế nào mà ko có hệ thống sạc đủ rộng để vận hành thì cũng thế. Đến năm 2030 nếu như có các hãng làm trạm sạc cho bên thứ 3 mở rộng hạ tầng sạc cho mọi loại xe điện của các hãng thì mới có thể đánh giá khách quan nhất được. Chứ gì nếu xét về sự tiện dụng khi vận hành chắc chỉ có Vin thôi",hiện_tại quy_t định chính việc mua xe_điện vn chính hệ_thống hạ_tầng trạm_sạc giờ mỗi vin phủ toàn_quốc n_u so_sánh vin ưu_th hẳn hãng khác ưu_việt th không hệ_thống sạc đủ rộng vận_hành th năm 2030 n_u hãng làm trạm_sạc bên mở_rộng hạ_tầng sạc xe_điện hãng mới có_thể đánh_giá khách_quan chứ u_xét sự tiện_dụng vận_hành chắc vin thôi,,,,,,
ANN_00347,1fd351d58bab6a1254d52b99ffc4bca21200b1e0de6fbf7b09c8f002b645ae6b,Mixed,Vf6 thế mạnh tram sạc byd thương hiệu toàn cầu,VinFast_VF6 th mạnh tram sạc byd thương_hiệu toàn_cầu,,,,,,
ANN_00348,f2f6176b600292463f00f6c607536445b1b656a51cc32f4e3d4062cff75c1845,Mixed,Xin em đừng có nên nói Toyota Honda nó không có làm xe điện đầu tư một cái trạm sạc lúc cồng kềnh nó tốn kém ngu dốt mới đầu tư sản xuất xe điện Thời đại bây giờ là động cơ xăng lai điện Hybrid là vừa tiết kiệm vừa bền bỉ vừa Tôi yêu được thời gian động cơ xăng Hybrid Xuân Này Có bán đi cũng được còn có giá trị còn mà động cơ thuần điện sau này có bán xe cũ chẳng có ai mua,xin em đừng nói toyota honda nó không làm xe_điện đầu_tư trạm_sạc cồng_kềnh nó tốn_chi_phí ngu_dốt mới đầu_tư sản_xuất xe_điện thời_đại bây_giờ động_cơ xăng lai_điện hybrid vừa ti t_kiệm vừa bền_bỉ vừa tôi yêu thời_gian động_cơ xăng hybrid xuân bán giá_trị động_cơ thuần_điện sau_này bán cũ chẳng mua,,,,,,
ANN_00349,b716c064262975a2dd07e9be72ff2753b57c88964ff34b60fa6d90d4bdbbac6d,Mixed,Lần đầu tiên thấy anh VA làm clip tán trợ lý ảo và bị từ chối hiểu 🤣🤣🤣. Chắc phải cập nhật cho em ý: a định dùng tư thế nào khi đang lái em ? 😄,đầu_tiên anh va làm clip tán_trợ l_ảo và từ_chối hiểu chắc phải cập_nhật em a_định dùng tư_th lái em positive_signal,,,,,,
ANN_00350,60b140805f4fbe2c584619afee5112aecb5a51599b39a246cfe8e8e28da6d93e,Mixed,"BYD ngoài các vấn đề trạm sạc, xưởng dịch vụ, hậu mãi, phụ tùng thay thế, cam kết gắn bó lâu dài của hãng như nhiều bác đã nói, Tôi thấy mỗi hãng xe hay rộng hơn một chút là xe của mỗi nước có một triết lý làm xe khác nhau, xe nhật bền bỉ, tiết kiệm, option vừa đủ, giá rẻ hơn sơ với xe âu mỹ, xe hàn nhanh xuống hơn xe nhật nhưng option phong phú hơn, mẫu mã hình thức trẻ trung thời thượng hơn, xe đức và âu thì đầm chắc, an toàn, cảm giác lái tốt, option full đi kèm giá chát phụ tùng thay thế bảo dưỡng sửa chưa ko dành cho đại chúng phổ thông, xe Mỹ thì hầm hố, to khoẻ, uống xăng hàng đầu, xe Trung quốc nói chung thì chưa có nhiều thời gian để đánh giá nhưng về cơ bản thì xe có những phần nhìn, nghe, sờ chạm được với những người đi xem và đi trải nghiệm thì ok, option miên man, hình thức đẹp thời thượng nhưng không sang chất, không có chất thiết kế riêng, tôi có xem các bài đánh giá xe trung bên trung quốc và cảm nhận riêng thì xe trung quốc có tuổi thọ sẽ không cao, khung gầm động cơ và các bộ phận cơ khí đi tầm vài năm là bắt đầu xuống cấp rất nhanh (vòng đời xe chỉ được tầm nửa so với xe nhật thôi), nói chung là xe trung quốc chú ý vào nước sơn hơn là gỗ, với xe việt đại diện là Vinfast thì tôi thấy triết lý làm xe họ có vẻ họ chú trọng kiểu tốt gỗ hơn tốt nước sơn, khi bắt đầu làm xe họ mua công nghệ của BMW, thiết kế châu âu, nên xe của VF tôi thấy đầm chắc, cảm giác lái tốt, các bộ phận cơ khí khá chất lượng (như các bác có thể thấy mấy con xe xăng của VF như fadil, lux nếu để dùng thì gần như không ai chê về độ đầm chắc...),  Với xe điện VF cũng triết lý đó xe có thể có một số bộ phận như nội thất như ghế, phần tapbi cửa, thiết kế một số chỗ chưa đẹp, hơp lý, nhưng về độ đầm chắc, an toàn, cảm giác lái, khung gầm và các bộ phần cơ khí thì tôi tin là hơn xe TQ. Theo tôi khi xem xe và lái thử trước khi mua xe thì mọi người hay quan tâm về option, nội thất, hình thức, thông số kỹ thuật nhưng khi dùng một thời gian thì thấy xe an toàn, đàm chắc, cảm giác lái hay, hậu mãi, bảo dưỡng sửa chữa rẻ và tiện lợi mới là cái quan trọng nhất.",byd ngoài vấn_đề trạm_sạc xưởng_s a_chữa dịch_vụ dịch_vụ_sau_bán phụ_tùng thay th cam_k gắn_bó lâu_dài hãng bác nói tôi mỗi hãng rộng một_chút mỗi nước tri làm khác nhật_bền bỉ_ti t_kiệm option vừa đủ giá rẻ sơ âu_mỹ hàn nhanh xe_nhật nhưng option phong_phú mẫu_mã hình_thức trẻ trung_thời thượng đức và âu đầm chắc an_toàn cảm_giác_lái tốt option full kèm giá_đắt phụ_tùng thay th bảo_dưỡng s_a chưa không dành đại_chúng phổ_thông mỹ hầm_hố to_khỏe uống xăng hàng_đầu trung_quốc nói_chung chưa thời_gian đánh_giá nhưng cơ_bản phần nhìn nghe sờ_chạm xem và trải_nghiệm đồng_ option miên_man hình_thức đẹp thời_thượng nhưng không sang chất không chất thi riêng tôi xem bài đánh_giá trung bên trung_quốc và cảm_nhận riêng trung_quốc tuổi_thọ không cao_khung gầm_động_cơ và bộ_phận cơ_khí tầm vài năm bắt_đầu xuống_cấp rất nhanh vòng đời tầm n_a so xe_nhật thôi nói_chung trung_quốc chú nước sơn gỗ việt đại_diện VinFast tôi tri_t làm họ có_vẻ họ chú_trọng tốt gỗ tốt nước sơn bắt_đầu làm họ mua công_nghệ bmw thi t_k châu_âu vf tôi đầm chắc cảm_giác_lái tốt bộ_phận cơ_khí khá chất_lượng bác có_thể mấy xăng vf fadil lux n_u dùng gần không chê độ đầm chắc xe_điện vf tri_t có_thể một_số bộ_phận nội_thất gh phần tapbi a_thi một_số chỗ chưa đẹp hơp_l nhưng độ đầm chắc an_toàn cảm_giác_lái khung gầm và bộ phần cơ_khí tôi tin tq tôi xem và lái th mua quan_tâm option nội_thất hình_thức thông_số kỹ_thuật nhưng dùng thời_gian an_toàn_đàm chắc cảm_giác_lái dịch_vụ_sau_bán bảo_dưỡng a_chữa rẻ và tiện_lợi mới quan_trọng,,,,,,
ANN_00351,badf9c79b165f5dbe0a741ccbac10cc1fd7749093417ad6eb4eea775603b6fad,Mixed,"Cách đây khoảng 1 tuần, một vụ cháy lớn xảy ra tại một nhà khu đậu xe ô tô cao 5 tầng tại công viên giải trí Disneyland ở California. Có tất cả 12 xe ô tô đã bị thiêu hủy hoàn toàn. Chiếc xe được cứu hỏa đầu tiên được xác định là xe hybrid Toyota RAV4, nhưng lời khai của nhân chứng cũng làm dấy lên nghi ngờ về một chiếc Kia Sportage. Cả hai loại xe vẫn đang được điều tra và các nhà chức trách đang xem xét nhiều khả năng khác nhau. Sự cố đã làm bùng lên các cuộc thảo luận xung quanh vấn đề an toàn cháy nổ của xe xăng lai (xe hybrid). Theo Ủy ban An toàn Giao thông Quốc gia của Hoa Kỳ (NTSB), tỷ lệ cháy nổ xảy ra đối với xe xăng lai PHEV (xe hybrid) là 3.475 vụ trên 100.000 xe, cao hơn đáng kể [gần gấp 3 lần] so với xe động cơ đốt trong (1.530 vụ) hoặc [cao hơn gần 139 lần] so với xe điện chạy bằng pin (BEV, 25 vụ) như xe điện Vinfast. Phân tích chỉ ra rằng hỗn hợp cấu trúc của hệ thống điện cao áp và nhiên liệu xăng/dầu góp phần gây ra nhiều yếu tố rủi ro cháy nổ của xe xăng lai PHEV (xe hybrid). Một số chuyên gia chỉ ra rằng mặc dù xe xăng lai (xe hybrid) có hiệu suất nhiên liệu tốt hơn và lượng khí thải giảm so với xe chạy bằng xăng thông thường, nhưng kỹ thuật công nghệ ứng phó cháy nổ cho hệ thống điện của xe xăng lai PHEV (xe hybrid) vẫn chưa được phát triển đầy đủ. Họ nhấn mạnh rằng nếu một chiếc xe xăng lai PHEV (xe hybrid) không sử dụng và đậu trong thời gian dài, nó có thể gặp sự cố về điện ở nhiệt độ cao. Xe Trung Quốc hiệu Dongfeng Mage, Huge, MG G50 và BYD Sealion 6 là những mẫu xe xăng lai PHEV (xe hybrid). Do đó nguy cơ bị cháy nổ cao hơn gấp 139 lần số với xe thuần điện Vinfast.",cách đây khoảng tuần vụ cháy lớn xảy nhà khu đậu ô_tô cao tầng công_viên giải_trí disneyland california tất_cả 12 ô_tô thiêu_hủy hoàn_toàn chi cứu hỏa đầu_tiên xác_định hybrid toyota_rav4 nhưng lời khai nhân_chứng làm dấy nghi_ngờ chi sportage hai điều_tra và nhà_chức_trách xem_xét khả_năng khác sự_cố làm bùng cuộc thảo_luận xung_quanh vấn_đề an_toàn cháy nổ xăng lai hybrid ủy ban an_toàn giao_thông quốc_gia hoa kỳ_ntsb tỷ_lệ cháy nổ xảy đối_với xăng lai_phev hybrid 475 vụ 100 000 cao đáng_kể gần gấp so động_cơ đốt 530 vụ cao gần 139 so xe_điện chạy bằng pin bev 25 vụ xe_điện VinFast phân_tích hỗn_hợp cấu_trúc hệ_thống điện cao_áp và nhiên_liệu xăng_dầu góp_phần gây y_u_tố rủi_ro cháy nổ xăng lai_phev hybrid một_số chuyên_gia mặc_dù xăng lai hybrid hiệu_suất nhiên_liệu tốt và lượng khí_thải giảm so chạy bằng xăng thông_thường nhưng kỹ_thuật công_nghệ ứng_phó cháy nổ hệ_thống điện xăng lai_phev hybrid chưa phát_triển đầy_đủ họ nhấn_mạnh n_u chi xăng lai_phev hybrid không s_dụng và đậu thời_gian dài nó có_thể gặp sự_cố điện nhiệt_độ cao trung_quốc hiệu dongfeng mage huge mg g50 và byd sealion mẫu xăng lai_phev hybrid do_đó nguy_cơ cháy nổ cao gấp 139 số thuần_điện VinFast,,,,,,
ANN_00352,468e4ff4c5e10d6ba6bae21ecb70706ab289a43dc2bd3e0c90caa0daaf1867b8,Mixed,"Những sản phẩm cũ lỗi thời như xe xăng lai/hybrid MG, BYD Sealion của Trung Quốc sẽ dần dần bị loại trừ vì không đáp ứng được nhu cầu cuộc sống hiện đại. Ai cũng biết động cơ xe xăng lai/hybrid như MG, BYD Sealion của Trung Quốc, có hơn 2.000 bộ phận di động, trong khi động cơ xe ô tô điện như của Vinfast chỉ có khoảng 20 bộ phận di động. Dĩ nhiên càng nhiều bộ phận di động, thì càng nhiều lực ma sát, tốn nhiều nhiên liệu và làm chậm tốc độ xe, và càng nhiều bộ phận di động thì càng dễ bị hư hỏng hao mòn, và tốn nhiều tiền hơn cho sửa chữa bảo trì. Do đó việc sử dụng xe ô tô điện có chất lượng tốt và độ an toàn cao như xe điện Vinfast là một giải pháp tối ưu cho hiện nay, nhờ xe điện ít tốn nhiên liệu, ít tốn tiền chi phí bảo trì sửa chữa dẫn đến ít thời gian chờ đợi vì xe phải sửa chữa và không gây ô nhiễm khói bụi. Theo báo cáo của tờ báo Bangkok Post cách đây vài tháng, chính phủ Thái Lan phải đóng cửa hơn 300 trường học ở Bangkok vì mức độ không khí ô nhiễm quá nghiêm trọng. Đây cũng là một tổn phí lớn về chất lượng giáo dục do ô nhiễm khói bụi gây ra. Vài tháng trước đó, ô nhiễm khói bụi ở Bangkok quá nặng nề khiến cho nhiều khách nước ngoài du lịch Thái Lan phải nhập viện cấp cứu do viêm nhiễm đường hô hấp.",sản_phẩm cũ lỗi_thời xăng lai_hybrid mg byd_sealion trung_quốc dần_dần loại_trừ không đáp_ứng nhu_cầu cuộc_sống hiện_đại bi_t động_cơ xăng lai_hybrid mg byd_sealion trung_quốc 000 bộ_phận di_động động_cơ ô_tô điện VinFast khoảng 20 bộ_phận di_động dĩ_nhiên càng bộ_phận di_động càng lực ma_sát tốn nhiên_liệu và làm chậm tốc_độ và càng bộ_phận di_động càng dễ hư_hỏng hao_mòn và tốn tiền a_chữa bảo_trì do_đó việc s_dụng ô_tô điện chất_lượng tốt và độ an_toàn cao xe_điện VinFast giải_pháp tối_ưu hiện_nay nhờ xe_điện ít tốn nhiên_liệu ít tốn tiền chi_phí bảo_trì a_chữa dẫn ít thời_gian chờ_đợi phải a_chữa và không gây ô_nhiễm khói bụi báo_cáo tờ báo bangkok post cách đây vài tháng chính_phủ thái_lan phải đóng 300 trường_học bangkok mức_độ không_khí ô_nhiễm nghiêm_trọng đây tổn_phí lớn chất_lượng giáo_dục do ô_nhiễm khói bụi gây vài tháng ô_nhiễm khói bụi bangkok nặng_nề khách nước_ngoài du_lịch thái_lan phải nhập_viện cấp_cứu do viêm_nhiễm đường hô_hấp,,,,,,
ANN_00353,d120f5d7de2a6398df50ab6b2062d76cc4106f77c977d5428193c54cd1551596,Mixed,Chỉ cần thêm một máy phát điện động cơ 110cc 3 xi lanh gắn phía trước để tự sạc là đẹp,cần máy_phát_điện động_cơ 110 cc xi_lanh gắn phía tự_sạc đẹp,,,,,,
ANN_00354,f90961b470dc9ce892d730963657f45ba3cdfa4e618df6d7b3318896cb458496,Mixed,"Mình đang sở hữu vf7 bản plus, cũng như vf6 và đã lái nhiều những mẫu tương tự như Yaris cross, atto 3. Mình cảm nhận thấy xe vinfast từ dòng VF 6,7,8 nó có một sự thiết kế chưa quá phù hợp với hầu hết nhu cầu của người Việt Nam. Thiết kế của họ đánh mạnh vào sự an toàn vỏ xe dày cánh cửa tapli khung sườn quá chắc chắn, kiểu thiết kế này giống như thiết kế bên châu âu đề cao sự an toàn, rất nhiều clip tai nạn của vinfast và chạm năng nhưng người lái xe vẫn an toàn, giống như một chiếc xe tăng vậy. Điều này hóa ra lại khiến cho bên trong xe chật hẹp hơn bình thường, nếu phải chở một gia đình nhiều người thì cảm giác nó không được rộng rãi thoải mái như những chiếc xe khác. 
Tất nhiên thì không thể đánh đổi sự an toàn nhưng thiết kế như vậy cảm giác nó không được thực dụng, thiết kế này mang hơi hướng thể thao hơn.",sở_hữu VinFast_VF7_bản plus VinFast_VF6 và lái mẫu tương_tự yaris cross BYD_Atto3 cảm_nhận VinFast dòng VinFast_VF6 nó sự thi_t chưa phù_hợp hầu_h nhu_cầu việt_nam thi t_k họ đánh mạnh sự an_toàn vỏ dày_cánh a_tapli khung sườn chắc_chắn thi t_k giống thi bên châu_âu đề_cao sự an_toàn rất clip tai_nạn VinFast và chạm_năng nhưng lái_xe an_toàn giống chi xe_tăng điều hóa bên chật_hẹp bình_thường n_u phải chở gia_đình cảm_giác nó không rộng_rãi thoải_mái chi khác tất_nhiên không_thể đánh_đổi sự an_toàn nhưng thi t_k như_vậy cảm_giác nó không thực_dụng thi t_k mang hơi hướng thể_thao,,,,,,
ANN_00355,8859f6e8d99df5dc59e57172f9e1bd0d971c0e0e055b2c3ee403b339969a4adb,Mixed,"Nhiều ng bị tàu lừa hết,tàu lên đk cung trăng,tàu ngầm,tàu sân bay,máy bay,tàu siêu tốc,công xưởng tg,ô tô của họ ngon tốt lắm,nói động cơ đốt trong tàu k có vẹo gì,ô tô điện khó ở cục pin do tàu nó tập chung về pin rất nhiều năm,còn phụ tùng tàu chỉ nhập 1 số bộ điều khiển của châi âu,chip..vv còn lại tự sx,còn phụ tùng do tàu sx ở mức khá k hề tốt,nhà nhà làm phụ tùng ô tô ,xe máy.vv nên phụ tùng tàu nó sx dễ như ăn kẹo,nên xe do tàu sx rất rẻ,còn vinfast họ làm ra sp nào từ khâu phụ tùng đều loại thương hiệu chất lượng hàng đầu,khung gầm dám khẳng định tốt hơn xe tàu,vin chỉ k sx cục pin và k sx đk phụ tùng khó trên con xe do nghành phụ trợ vn quá kém cỏi nhưng trong 5,10 năm tới vn sẽ làm đk,1 con ô tô họ sx 60% 2026 85% là quá đỉnh r,đất nc bộ phòng mạnh,sx đk nhữnh thứ to lớn k đồng nghĩa là ô tô,xe máy họ làm tốt điển hình như thằng nga k gì k sx đk,nhưng nghành ô tô k làm ra hồn toàn con xe phát gớm,vinfast chỉ thua xe tàu là nguồn gốc,xuất xứ k bằng do phụ trợ vn quá yếu kém+chưa sx đk pin,đến tesla,mẹc,bmw..vvv,xe toyota,mitsubishi còn chưa sx đk pin,kể cả sx đk chi phí quá cao k thể đưa vô thương mại đk thì họ mua luôn cục pin tàu cho nhanh mà rẻ hơn,còn chất lượng xe tàu tin tôi đi đi ngoài 100.000km sau 5,6 năm nó sẽ cho b biết thế nào là khổ,nhiều hãng xe nổi tiếng đi 10v bắt đầu đi dở và cần phải tu sửa rất nhiều mới ngon đk,bị những lỗi khó hiểu,mình công nhận trung quốc ô tô họ đang phát triển quá tốt,chất lượng cũng ok,nhưng khâu kiểm soát và tiêu chuẩn xe tàu rất tào lao,nên đầu ra xe tàu k chuẩn như quảng cáo,BYD này hãng xe thương hiệu mạnh ở trung quốc k đồng nghĩa mạnh trên thế giới,nên đừng bị lừa nhé,mitsubishi kêi sx cái lọ cái kia nhưng ô tô sx rất chán đời k bền k ngon như toyota,k đk ưa chuộng,",ng tàu lừa_đảo tàu đk cung_trăng tàu ngầm tàu sân_bay máy_bay tàu siêu_tốc công_xưởng_s a_chữa tg ô_tô họ ngon tốt nói động_cơ đốt tàu không vẹo ô_tô điện khó cục pin do tàu nó tập chung pin rất năm phụ_tùng tàu nhập số bộ điều_khiển châi âu_chip vv tự sx phụ_tùng do tàu sx mức khá không hề tốt nhà_nhà làm phụ_tùng ô_tô xe_máy vv phụ_tùng tàu nó sx dễ ăn_kẹo do tàu sx rất rẻ VinFast họ làm sản_phẩm khâu phụ_tùng đều thương_hiệu chất_lượng hàng_đầu khung gầm_dám khẳng_định tốt xe_trung_quốc vin không sx cục pin và không sx đk phụ_tùng khó do ngành phụ_trợ vn kém_cỏi nhưng 10 năm tới vn làm đk ô_tô họ sx 60 2026 85 đỉnh đất nc_bộ phòng mạnh sx đk nhữnh to_lớn không đồng_nghĩa_là ô_tô xe_máy họ làm tốt_điển_hình thằng nga không không sx_đk nhưng ngành ô_tô không làm ra_hồn phát gớm VinFast thua xe_trung_quốc nguồn_gốc xuất_xứ không bằng do phụ_trợ vn y_u chưa sx đk pin tesla mẹc bmw vvv toyota mitsubishi chưa sx đk_pin kể_cả sx đk chi_phí cao không_thể đưa thương_mại đk họ mua cục pin tàu nhanh rẻ chất_lượng xe_trung_quốc tin tôi đi_đi ngoài 100 000 km năm nó bi_t th khổ hãng nổi_ti ng 10 bắt_đầu dở và cần phải tu_s rất mới ngon_đk lỗi khó hiểu công_nhận trung_quốc ô_tô họ phát_triển tốt chất_lượng đồng_ nhưng khâu kiểm_soát và tiêu_chuẩn xe_trung_quốc rất tào_lao đầu_ra xe_trung_quốc không chuẩn quảng_cáo byd hãng thương_hiệu mạnh trung_quốc không đồng_nghĩa mạnh th_giới đừng lừa_đảo mitsubishi kêi sx lọ nhưng ô_tô sx rất chán_đời không bền không ngon toyota không đk ưa_chuộng,,,,,,
